{
  "$schema": "https://json-schema.org/draft/2020-12/schema",
  "title": "pacing.json",
  "description": "Delivery's launch limits, read by capacity.sh and hq. scripts/check-pacing.sh checks pacing.json against this schema, and that every route names a known provider.",
  "type": "object",
  "required": ["designSlots", "slots", "imp", "providers", "routes"],
  "additionalProperties": false,
  "properties": {
    "designSlots": {
      "type": "integer",
      "description": "How many design passes with the owner run at a time.",
      "minimum": 0,
      "maximum": 100
    },
    "agentDesignSlots": {
      "type": "integer",
      "description": "How many design passes that need no owner run at a time. hq uses 2 when the key is absent.",
      "minimum": 0,
      "maximum": 100
    },
    "slots": {
      "type": "object",
      "description": "How many delivery sessions run on the imps and on this host.",
      "required": ["imp", "local"],
      "additionalProperties": false,
      "properties": {
        "imp": {
          "type": "integer",
          "minimum": 0,
          "maximum": 100
        },
        "local": {
          "type": "integer",
          "minimum": 0,
          "maximum": 100
        }
      }
    },
    "imp": {
      "type": "object",
      "required": ["impMib"],
      "additionalProperties": false,
      "properties": {
        "impMib": {
          "type": "integer",
          "minimum": 1
        }
      }
    },
    "providers": {
      "type": "object",
      "minProperties": 1,
      "additionalProperties": {
        "$ref": "#/$defs/provider"
      }
    },
    "routes": {
      "type": "object",
      "required": ["S", "M", "L", "XL"],
      "additionalProperties": false,
      "properties": {
        "S": {
          "$ref": "#/$defs/route"
        },
        "M": {
          "$ref": "#/$defs/route"
        },
        "L": {
          "$ref": "#/$defs/route"
        },
        "XL": {
          "$ref": "#/$defs/route"
        }
      }
    },
    "placeTypes": {
      "type": "object",
      "description": "The issue Types each place takes; a place with no list takes every Type.",
      "minProperties": 1,
      "additionalProperties": false,
      "properties": {
        "imp": {
          "$ref": "#/$defs/placeTypeList"
        },
        "local": {
          "$ref": "#/$defs/placeTypeList"
        }
      }
    }
  },
  "$defs": {
    "provider": {
      "type": "object",
      "required": ["agent", "threshold", "unattended", "target"],
      "additionalProperties": false,
      "properties": {
        "agent": {
          "type": "string",
          "minLength": 1
        },
        "threshold": {
          "type": "number",
          "minimum": 0,
          "maximum": 100
        },
        "unattended": {
          "type": "boolean"
        },
        "target": {
          "enum": ["imp", "local"]
        },
        "localFallback": {
          "type": "integer",
          "minimum": 0
        }
      }
    },
    "route": {
      "type": "array",
      "minItems": 1,
      "items": {
        "type": "string"
      }
    },
    "placeTypeList": {
      "type": "array",
      "minItems": 1,
      "items": {
        "type": "string",
        "enum": ["Bug", "Feature", "Improvement", "Chore", "Design", "Investigation"]
      }
    }
  }
}
