{
  "designSlots": 1,
  "agentDesignSlots": 2,
  "slots": {
    "imp": 7,
    "local": 3
  },
  "placeTypes": {
    "local": ["Investigation"]
  },
  "imp": {
    "impMib": 2048
  },
  "providers": {
    "codex": {
      "agent": "codex",
      "threshold": 80,
      "unattended": false,
      "target": "local"
    },
    "claude": {
      "agent": "claude",
      "threshold": 95,
      "unattended": true,
      "target": "imp",
      "localFallback": 3
    }
  },
  "routes": {
    "S": ["codex", "claude"],
    "M": ["codex", "claude"],
    "L": ["claude"],
    "XL": ["claude"]
  }
}
